-- Hive Iceberg FDW Write/CRUD Coverage Test
-- Purpose: exercise the iceberg FDW write path end to end (INSERT / UPDATE /
-- DELETE / SELECT) against a Hive-catalog iceberg table.
--
-- This drives dlproxy's write path: getOrCreateSchema + batchAppend (INSERT)
-- and rowUpdate (UPDATE/DELETE, merge-on-read positional deletes). All three
-- require the gopher socket config (gopher.worker_path etc.) to be sent in the
-- write request body so the agent's iceberg catalog FileIO initializes; the
-- fixture is format-version 2 so UPDATE/DELETE can write delete files.
--
-- Fixture default.iceberg_fdw_crud (3 rows, v2) is created by
-- prepare/prepare_hive/hive_iceberg_fdw.sql via spark-sql.
SET client_min_messages = ERROR;
DROP FOREIGN DATA WRAPPER IF EXISTS datalake_fdw CASCADE;
CREATE EXTENSION IF NOT EXISTS datalake_fdw;
CREATE EXTENSION IF NOT EXISTS hive_connector;
RESET client_min_messages;
CREATE FOREIGN DATA WRAPPER datalake_fdw
    HANDLER datalake_fdw_handler
    VALIDATOR datalake_fdw_validator
    OPTIONS (mpp_execute 'all segments');
SELECT public.create_foreign_server('hive_server', 'gpadmin', 'datalake_fdw', 'paa_cluster');
 create_foreign_server 
-----------------------
 t
(1 row)

SET datestyle = ISO, MDY;
DROP FOREIGN TABLE IF EXISTS iceberg_fdw_crud;
NOTICE:  foreign table "iceberg_fdw_crud" does not exist, skipping
CREATE FOREIGN TABLE iceberg_fdw_crud (
    id bigint,
    name text,
    amount double precision
)
SERVER hive_server
OPTIONS (
    filePath 'default.iceberg_fdw_crud',
    catalog_type 'hive',
    server_name 'hive_cluster',
    hdfs_cluster_name 'paa_cluster',
    table_identifier 'default.iceberg_fdw_crud',
    format 'iceberg'
);
-- ============================================================
-- Baseline read (3 seed rows)
-- ============================================================
SELECT id, name, amount FROM iceberg_fdw_crud ORDER BY id;
 id | name  | amount 
----+-------+--------
  1 | alice |    100
  2 | bob   |    200
  3 | carol |    300
(3 rows)

-- ============================================================
-- INSERT (dlproxy getOrCreateSchema + batchAppend write path)
-- ============================================================
INSERT INTO iceberg_fdw_crud VALUES (4, 'dave', 400.0);
INSERT INTO iceberg_fdw_crud VALUES (5, 'erin', 500.0), (6, 'frank', 600.0);
SELECT id, name, amount FROM iceberg_fdw_crud ORDER BY id;
 id | name  | amount 
----+-------+--------
  1 | alice |    100
  2 | bob   |    200
  3 | carol |    300
  4 | dave  |    400
  5 | erin  |    500
  6 | frank |    600
(6 rows)

-- ============================================================
-- UPDATE (merge-on-read: positional delete + new data file)
-- ============================================================
UPDATE iceberg_fdw_crud SET amount = 999.0 WHERE id = 2;
SELECT id, name, amount FROM iceberg_fdw_crud ORDER BY id;
 id | name  | amount 
----+-------+--------
  1 | alice |    100
  2 | bob   |    999
  3 | carol |    300
  4 | dave  |    400
  5 | erin  |    500
  6 | frank |    600
(6 rows)

-- ============================================================
-- DELETE (merge-on-read positional delete)
-- ============================================================
DELETE FROM iceberg_fdw_crud WHERE id = 4;
SELECT id, name, amount FROM iceberg_fdw_crud ORDER BY id;
 id | name  | amount 
----+-------+--------
  1 | alice |    100
  2 | bob   |    999
  3 | carol |    300
  5 | erin  |    500
  6 | frank |    600
(5 rows)

SELECT count(*) AS final_count FROM iceberg_fdw_crud;
 final_count 
-------------
           5
(1 row)

-- ============================================================
-- Cleanup
-- ============================================================
DROP FOREIGN TABLE iceberg_fdw_crud;
