-- Hadoop-catalog over HDFS volume basic functional smoke for Iceberg AM.
--
-- Routes through the new HDFS volume helper (processVolumeHdfsResource)
-- and the iceberg HadoopCatalog with `fs.defaultFS = hdfs://...` and
-- `RequestContext.path = <warehouse-path>` set by
-- processS3OrHadoopServerResource.
\i ../../../lib/sql/common_setup.sql
-- common_setup.sql
-- Base setup for all datalake_fdw tests
-- This file should be included at the beginning of all test SQL files
-- Create required extensions
CREATE EXTENSION IF NOT EXISTS datalake_fdw;
CREATE EXTENSION IF NOT EXISTS hive_connector;
-- gp_exttable_delimiter may not be available in all environments.
-- Silence the "already exists, skipping" NOTICE emitted in CI where the
-- extension has been created by an earlier test or initdb step.
SET client_min_messages = WARNING;
DO $$ BEGIN
    CREATE EXTENSION IF NOT EXISTS gp_exttable_delimiter;
EXCEPTION WHEN OTHERS THEN
    -- Extension not available, skip silently
END $$;
RESET client_min_messages;
-- Create foreign data wrapper if not already present
-- Note: CREATE FOREIGN DATA WRAPPER does not support IF NOT EXISTS syntax
DO $$ BEGIN
    IF NOT EXISTS (SELECT 1 FROM pg_foreign_data_wrapper WHERE fdwname = 'datalake_fdw') THEN
        EXECUTE 'CREATE FOREIGN DATA WRAPPER datalake_fdw
            HANDLER datalake_fdw_handler
            VALIDATOR datalake_fdw_validator
            OPTIONS (mpp_execute ''all segments'')';
    END IF;
END $$;
-- Set standard date style for consistent output
SET datestyle = ISO, MDY;
-- Create logging utility function
CREATE OR REPLACE FUNCTION test_log(message text)
RETURNS void AS $$
BEGIN
    RAISE NOTICE '[TEST] %', message;
END;
$$ LANGUAGE plpgsql;
-- Log setup completion
SELECT test_log('Common setup completed');
NOTICE:  [TEST] Common setup completed
 test_log 
----------
 
(1 row)

DROP SERVER IF EXISTS hd_hdfs_cat_srv CASCADE;
NOTICE:  server "hd_hdfs_cat_srv" does not exist, skipping
CREATE SERVER hd_hdfs_cat_srv FOREIGN DATA WRAPPER iceberg_catalog_fdw
    OPTIONS (type 'hadoop');
CREATE USER MAPPING FOR current_user SERVER hd_hdfs_cat_srv;
CREATE FOREIGN CATALOG hd_hdfs_cat SERVER hd_hdfs_cat_srv
    OPTIONS (warehouse_location_prefix 'hdfs://hadoop:8020/iceberg_hadoop_hdfs_smoke/');
SET iceberg_default_catalog = 'hd_hdfs_cat';
DROP SERVER IF EXISTS hd_hdfs_vol_srv CASCADE;
NOTICE:  server "hd_hdfs_vol_srv" does not exist, skipping
CREATE SERVER hd_hdfs_vol_srv FOREIGN DATA WRAPPER iceberg_volume_fdw
    OPTIONS (type 'hdfs', endpoint 'hdfs://hadoop:8020');
CREATE USER MAPPING FOR current_user SERVER hd_hdfs_vol_srv
    OPTIONS (username 'gpadmin');
CREATE FOREIGN VOLUME hd_hdfs_vol SERVER hd_hdfs_vol_srv
    OPTIONS (base_path '/iceberg_hadoop_hdfs_smoke/', allow_writes 'true');
SET iceberg_default_volume = 'hd_hdfs_vol';
DROP TABLE IF EXISTS hd_hdfs_smoke;
NOTICE:  table "hd_hdfs_smoke" does not exist, skipping
CREATE ICEBERG TABLE hd_hdfs_smoke (id INT, name VARCHAR(50), val DECIMAL(10,2));
\echo === T1 INSERT seed (5 rows) ===
=== T1 INSERT seed (5 rows) ===
INSERT INTO hd_hdfs_smoke
    VALUES (1, 'alpha',   1.50),
           (2, 'beta',    2.75),
           (3, 'gamma',   3.14),
           (4, 'delta',   4.20),
           (5, 'epsilon', 5.00);
SELECT count(*) AS after_seed FROM hd_hdfs_smoke;
 after_seed 
------------
          5
(1 row)

\echo === T2 single-row UPDATE id=2 ===
=== T2 single-row UPDATE id=2 ===
UPDATE hd_hdfs_smoke SET val = 99.99 WHERE id = 2;
SELECT id, name, val FROM hd_hdfs_smoke WHERE id = 2;
 id | name |  val  
----+------+-------
  2 | beta | 99.99
(1 row)

\echo === T3 single-row DELETE id=4 ===
=== T3 single-row DELETE id=4 ===
DELETE FROM hd_hdfs_smoke WHERE id = 4;
SELECT count(*) AS after_delete FROM hd_hdfs_smoke;
 after_delete 
--------------
            4
(1 row)

\echo === T4 incremental INSERT (2 rows) ===
=== T4 incremental INSERT (2 rows) ===
INSERT INTO hd_hdfs_smoke VALUES (6, 'zeta', 6.66), (7, 'eta', 7.77);
SELECT count(*) AS after_second_insert FROM hd_hdfs_smoke;
 after_second_insert 
---------------------
                   6
(1 row)

\echo === T5 multi-row UPDATE id<=3 (3 rows) ===
=== T5 multi-row UPDATE id<=3 (3 rows) ===
UPDATE hd_hdfs_smoke SET name = name || '_v2' WHERE id <= 3;
\echo === final ordered state ===
=== final ordered state ===
SELECT id, name, val FROM hd_hdfs_smoke ORDER BY id;
 id |   name   |  val  
----+----------+-------
  1 | alpha_v2 |  1.50
  2 | beta_v2  | 99.99
  3 | gamma_v2 |  3.14
  5 | epsilon  |  5.00
  6 | zeta     |  6.66
  7 | eta      |  7.77
(6 rows)

\echo === final aggregate ===
=== final aggregate ===
SELECT count(*) AS final_rows,
       count(*) FILTER (WHERE name LIKE '%\_v2' ESCAPE '\') AS rows_with_v2_suffix,
       sum(val) AS sum_val
FROM hd_hdfs_smoke;
 final_rows | rows_with_v2_suffix | sum_val 
------------+---------------------+---------
          6 |                   3 |  124.06
(1 row)

DROP TABLE hd_hdfs_smoke;
