-- 02_update_delete.sql
-- Test Iceberg UPDATE and DELETE operations
\i ../../../lib/sql/common_setup.sql
-- common_setup.sql
-- Base setup for all datalake_fdw tests
-- This file should be included at the beginning of all test SQL files
-- Create required extensions
CREATE EXTENSION IF NOT EXISTS datalake_fdw;
NOTICE:  extension "datalake_fdw" already exists, skipping
CREATE EXTENSION IF NOT EXISTS hive_connector;
NOTICE:  extension "hive_connector" already exists, skipping
-- gp_exttable_delimiter may not be available in all environments.
-- Silence the "already exists, skipping" NOTICE emitted in CI where the
-- extension has been created by an earlier test or initdb step.
SET client_min_messages = WARNING;
DO $$ BEGIN
    CREATE EXTENSION IF NOT EXISTS gp_exttable_delimiter;
EXCEPTION WHEN OTHERS THEN
    -- Extension not available, skip silently
END $$;
RESET client_min_messages;
-- Create foreign data wrapper if not already present
-- Note: CREATE FOREIGN DATA WRAPPER does not support IF NOT EXISTS syntax
DO $$ BEGIN
    IF NOT EXISTS (SELECT 1 FROM pg_foreign_data_wrapper WHERE fdwname = 'datalake_fdw') THEN
        EXECUTE 'CREATE FOREIGN DATA WRAPPER datalake_fdw
            HANDLER datalake_fdw_handler
            VALIDATOR datalake_fdw_validator
            OPTIONS (mpp_execute ''all segments'')';
    END IF;
END $$;
-- Set standard date style for consistent output
SET datestyle = ISO, MDY;
-- Create logging utility function
CREATE OR REPLACE FUNCTION test_log(message text)
RETURNS void AS $$
BEGIN
    RAISE NOTICE '[TEST] %', message;
END;
$$ LANGUAGE plpgsql;
-- Log setup completion
SELECT test_log('Common setup completed');
NOTICE:  [TEST] Common setup completed
 test_log 
----------
 
(1 row)

SELECT test_log('Feature Test: Iceberg UPDATE and DELETE');
NOTICE:  [TEST] Feature Test: Iceberg UPDATE and DELETE
 test_log 
----------
 
(1 row)

-- ============================================================
-- Setup: Catalog and volume
-- ============================================================
CREATE SERVER ud_catalog_server FOREIGN DATA WRAPPER iceberg_catalog_fdw;
CREATE USER MAPPING FOR current_user SERVER ud_catalog_server;
CREATE FOREIGN CATALOG ud_catalog SERVER ud_catalog_server;
SET iceberg_default_catalog = 'ud_catalog';
CREATE SERVER ud_volume_server FOREIGN DATA WRAPPER iceberg_volume_fdw
OPTIONS (type 's3', endpoint 'http://minio:9000', region 'us-east-1',
         bucket_name 'warehouse', path_style_access 'true');
CREATE USER MAPPING FOR current_user SERVER ud_volume_server
OPTIONS (access_key_id 'admin', secret_access_key 'admin12345');
CREATE FOREIGN VOLUME ud_volume SERVER ud_volume_server OPTIONS(base_path '/ud_volume/');
SET iceberg_default_volume = 'ud_volume';
CREATE ICEBERG TABLE ud_data (id bigint, name text, value decimal(10,2));
INSERT INTO ud_data VALUES
    (1, 'alpha', 100.00),
    (2, 'beta', 200.00),
    (3, 'gamma', 300.00),
    (4, 'delta', 400.00),
    (5, 'epsilon', 500.00);
-- ============================================================
-- Test 1: Basic UPDATE SET ... WHERE
-- ============================================================
SELECT test_log('Test 1: Basic UPDATE');
NOTICE:  [TEST] Test 1: Basic UPDATE
 test_log 
----------
 
(1 row)

UPDATE ud_data SET value = 150.00 WHERE id = 1;
SELECT id, name, value FROM ud_data WHERE id = 1;
 id | name  | value  
----+-------+--------
  1 | alpha | 150.00
(1 row)

-- ============================================================
-- Test 2: UPDATE with expression
-- ============================================================
SELECT test_log('Test 2: UPDATE with expression');
NOTICE:  [TEST] Test 2: UPDATE with expression
 test_log 
----------
 
(1 row)

UPDATE ud_data SET value = value * 1.1 WHERE id = 2;
SELECT id, name, value FROM ud_data WHERE id = 2;
 id | name | value  
----+------+--------
  2 | beta | 220.00
(1 row)

-- ============================================================
-- Test 3: UPDATE multiple columns
-- ============================================================
SELECT test_log('Test 3: UPDATE multiple columns');
NOTICE:  [TEST] Test 3: UPDATE multiple columns
 test_log 
----------
 
(1 row)

UPDATE ud_data SET name = 'GAMMA', value = 333.33 WHERE id = 3;
SELECT id, name, value FROM ud_data WHERE id = 3;
 id | name  | value  
----+-------+--------
  3 | GAMMA | 333.33
(1 row)

-- ============================================================
-- Test 4: Basic DELETE WHERE
-- ============================================================
SELECT test_log('Test 4: Basic DELETE');
NOTICE:  [TEST] Test 4: Basic DELETE
 test_log 
----------
 
(1 row)

DELETE FROM ud_data WHERE id = 4;
SELECT COUNT(*) AS after_delete FROM ud_data;
 after_delete 
--------------
            4
(1 row)

SELECT id FROM ud_data ORDER BY id;
 id 
----
  1
  2
  3
  5
(4 rows)

-- ============================================================
-- Test 5: INSERT after DELETE (reuse rows)
-- ============================================================
SELECT test_log('Test 5: INSERT after DELETE');
NOTICE:  [TEST] Test 5: INSERT after DELETE
 test_log 
----------
 
(1 row)

INSERT INTO ud_data VALUES (6, 'zeta', 600.00), (7, 'eta', 700.00);
SELECT COUNT(*) AS after_insert FROM ud_data;
 after_insert 
--------------
            6
(1 row)

SELECT * FROM ud_data ORDER BY id;
 id |  name   | value  
----+---------+--------
  1 | alpha   | 150.00
  2 | beta    | 220.00
  3 | GAMMA   | 333.33
  5 | epsilon | 500.00
  6 | zeta    | 600.00
  7 | eta     | 700.00
(6 rows)

-- ============================================================
-- Test 6: UPDATE + DELETE combo, verify with aggregates
-- ============================================================
SELECT test_log('Test 6: UPDATE + DELETE combo');
NOTICE:  [TEST] Test 6: UPDATE + DELETE combo
 test_log 
----------
 
(1 row)

UPDATE ud_data SET value = 0.00 WHERE id = 5;
DELETE FROM ud_data WHERE id = 7;
SELECT COUNT(*) AS final_count, SUM(value) AS final_sum FROM ud_data;
 final_count | final_sum 
-------------+-----------
           5 |   1303.33
(1 row)

-- ============================================================
-- Test 7: DELETE all rows
-- ============================================================
SELECT test_log('Test 7: DELETE all rows');
NOTICE:  [TEST] Test 7: DELETE all rows
 test_log 
----------
 
(1 row)

CREATE ICEBERG TABLE ud_empty_test (id bigint, val int);
INSERT INTO ud_empty_test VALUES (1, 10), (2, 20), (3, 30);
DELETE FROM ud_empty_test WHERE id > 0;
SELECT COUNT(*) AS should_be_zero FROM ud_empty_test;
 should_be_zero 
----------------
              0
(1 row)

-- ============================================================
-- Test 8: UPDATE/DELETE on empty table (no error)
-- ============================================================
SELECT test_log('Test 8: UPDATE/DELETE on empty table');
NOTICE:  [TEST] Test 8: UPDATE/DELETE on empty table
 test_log 
----------
 
(1 row)

UPDATE ud_empty_test SET val = 999 WHERE id = 1;
DELETE FROM ud_empty_test WHERE id = 1;
SELECT COUNT(*) AS still_zero FROM ud_empty_test;
 still_zero 
------------
          0
(1 row)

-- ============================================================
-- Cleanup
-- ============================================================
DROP TABLE ud_data;
DROP TABLE ud_empty_test;
DROP VOLUME ud_volume;
DROP USER MAPPING FOR current_user SERVER ud_volume_server;
DROP SERVER ud_volume_server;
DROP CATALOG ud_catalog;
DROP USER MAPPING FOR current_user SERVER ud_catalog_server;
DROP SERVER ud_catalog_server;
