-- Iceberg UPDATE/DELETE-with-subquery Regression Test
-- Purpose: Verify cross-table subqueries (IN / NOT EXISTS) in the WHERE
--          clause of an Iceberg UPDATE/DELETE do not trip
--          "Failed to get file path for file ID 0 in Iceberg update".
-- Tracks:  issue #333.  Plan inserts a Redistribute Motion between the
--          iceberg scan and the ModifyTable, putting them in different
--          slices; the writer QE never runs the scan, so without the fix
--          its file index map is empty and any file_id lookup fails.
--          DELETE shares the same file-id decode path (Case D below).
CREATE EXTENSION IF NOT EXISTS datalake_fdw;
NOTICE:  extension "datalake_fdw" already exists, skipping
-- Pin DateStyle so the textual representation in the expected file is stable
-- regardless of the cluster's default (the demo cluster uses SQL,MDY).
SET DateStyle = 'ISO, YMD';
-- catalog + volume setup (mirrors the other smoke tests in this dir)
CREATE SERVER us_catalog_server FOREIGN DATA WRAPPER iceberg_catalog_fdw;
CREATE USER MAPPING FOR current_user SERVER us_catalog_server;
CREATE FOREIGN CATALOG us_catalog SERVER us_catalog_server;
SET iceberg_default_catalog = 'us_catalog';
CREATE SERVER us_volume_server FOREIGN DATA WRAPPER iceberg_volume_fdw
OPTIONS (type 's3', endpoint 'http://minio:9000', region 'us-east-1',
         bucket_name 'warehouse', path_style_access 'true');
CREATE USER MAPPING FOR current_user SERVER us_volume_server
OPTIONS (access_key_id 'admin', secret_access_key 'admin12345');
CREATE FOREIGN VOLUME us_volume SERVER us_volume_server OPTIONS(base_path '/us_volume/');
SET iceberg_default_volume = 'us_volume';
-- ============================================================
-- Schema: a heap baseline (`us_heap`) and an iceberg subject (`us_ice`)
-- of identical shape, plus a small filter table.  Insert ten rows; the
-- filter table picks three of them.
-- ============================================================
CREATE TABLE us_heap (id BIGINT, deposit BIGINT, end_date DATE) DISTRIBUTED BY (id);
CREATE ICEBERG TABLE us_ice  (id BIGINT, deposit BIGINT, end_date DATE);
CREATE TABLE us_pick (id BIGINT) DISTRIBUTED BY (id);
INSERT INTO us_heap SELECT g, 100, DATE '2999-12-31' FROM generate_series(1,10) g;
INSERT INTO us_ice  SELECT g, 100, DATE '2999-12-31' FROM generate_series(1,10) g;
INSERT INTO us_pick VALUES (2), (4), (6);
-- ============================================================
-- Case A: WHERE id IN (SELECT ...) — semi-join filter
-- ============================================================
UPDATE us_heap SET end_date = DATE '2020-01-01'
WHERE end_date = DATE '2999-12-31'
  AND id IN (SELECT id FROM us_pick);
UPDATE us_ice  SET end_date = DATE '2020-01-01'
WHERE end_date = DATE '2999-12-31'
  AND id IN (SELECT id FROM us_pick);
SELECT COUNT(*) AS heap_total FROM us_heap;
 heap_total 
------------
         10
(1 row)

SELECT COUNT(*) AS ice_total  FROM us_ice;
 ice_total 
-----------
        10
(1 row)

SELECT id, end_date FROM us_heap ORDER BY id;
 id |  end_date  
----+------------
  1 | 2999-12-31
  2 | 2020-01-01
  3 | 2999-12-31
  4 | 2020-01-01
  5 | 2999-12-31
  6 | 2020-01-01
  7 | 2999-12-31
  8 | 2999-12-31
  9 | 2999-12-31
 10 | 2999-12-31
(10 rows)

SELECT id, end_date FROM us_ice  ORDER BY id;
 id |  end_date  
----+------------
  1 | 2999-12-31
  2 | 2020-01-01
  3 | 2999-12-31
  4 | 2020-01-01
  5 | 2999-12-31
  6 | 2020-01-01
  7 | 2999-12-31
  8 | 2999-12-31
  9 | 2999-12-31
 10 | 2999-12-31
(10 rows)

-- ============================================================
-- Case B: WHERE NOT EXISTS (SELECT ... WHERE ...) — anti-join filter
-- ============================================================
UPDATE us_heap SET end_date = DATE '2020-01-02'
WHERE end_date = DATE '2999-12-31'
  AND NOT EXISTS (SELECT 1 FROM us_pick WHERE us_pick.id = us_heap.id);
UPDATE us_ice  SET end_date = DATE '2020-01-02'
WHERE end_date = DATE '2999-12-31'
  AND NOT EXISTS (SELECT 1 FROM us_pick WHERE us_pick.id = us_ice.id);
SELECT COUNT(*) AS heap_total FROM us_heap;
 heap_total 
------------
         10
(1 row)

SELECT COUNT(*) AS ice_total  FROM us_ice;
 ice_total 
-----------
        10
(1 row)

SELECT id, end_date FROM us_heap ORDER BY id;
 id |  end_date  
----+------------
  1 | 2020-01-02
  2 | 2020-01-01
  3 | 2020-01-02
  4 | 2020-01-01
  5 | 2020-01-02
  6 | 2020-01-01
  7 | 2020-01-02
  8 | 2020-01-02
  9 | 2020-01-02
 10 | 2020-01-02
(10 rows)

SELECT id, end_date FROM us_ice  ORDER BY id;
 id |  end_date  
----+------------
  1 | 2020-01-02
  2 | 2020-01-01
  3 | 2020-01-02
  4 | 2020-01-01
  5 | 2020-01-02
  6 | 2020-01-01
  7 | 2020-01-02
  8 | 2020-01-02
  9 | 2020-01-02
 10 | 2020-01-02
(10 rows)

-- ============================================================
-- Case C: transactional NOT EXISTS + IN (the zipper_change.sql shape
-- from the original bug repro).  After both UPDATEs every row should
-- carry end_date = 2020-01-03 on both the heap and iceberg sides.
--
-- Note: we DROP+CREATE rather than TRUNCATE here because TRUNCATE is
-- currently a no-op on the iceberg AM (separate pre-existing issue).
-- ============================================================
DROP TABLE us_heap;
DROP TABLE us_ice;
CREATE TABLE us_heap (id BIGINT, deposit BIGINT, end_date DATE) DISTRIBUTED BY (id);
CREATE ICEBERG TABLE us_ice  (id BIGINT, deposit BIGINT, end_date DATE);
INSERT INTO us_heap SELECT g, 100, DATE '2999-12-31' FROM generate_series(1,10) g;
INSERT INTO us_ice  SELECT g, 100, DATE '2999-12-31' FROM generate_series(1,10) g;
BEGIN;
UPDATE us_heap SET end_date = DATE '2020-01-03'
WHERE end_date = DATE '2999-12-31'
  AND NOT EXISTS (SELECT 1 FROM us_pick WHERE us_pick.id = us_heap.id);
UPDATE us_heap SET end_date = DATE '2020-01-03'
WHERE end_date = DATE '2999-12-31'
  AND id IN (SELECT id FROM us_pick);
COMMIT;
BEGIN;
UPDATE us_ice  SET end_date = DATE '2020-01-03'
WHERE end_date = DATE '2999-12-31'
  AND NOT EXISTS (SELECT 1 FROM us_pick WHERE us_pick.id = us_ice.id);
UPDATE us_ice  SET end_date = DATE '2020-01-03'
WHERE end_date = DATE '2999-12-31'
  AND id IN (SELECT id FROM us_pick);
COMMIT;
SELECT COUNT(*) AS heap_total FROM us_heap;
 heap_total 
------------
         10
(1 row)

SELECT COUNT(*) AS ice_total  FROM us_ice;
 ice_total 
-----------
        10
(1 row)

SELECT id, end_date FROM us_heap ORDER BY id;
 id |  end_date  
----+------------
  1 | 2020-01-03
  2 | 2020-01-03
  3 | 2020-01-03
  4 | 2020-01-03
  5 | 2020-01-03
  6 | 2020-01-03
  7 | 2020-01-03
  8 | 2020-01-03
  9 | 2020-01-03
 10 | 2020-01-03
(10 rows)

SELECT id, end_date FROM us_ice  ORDER BY id;
 id |  end_date  
----+------------
  1 | 2020-01-03
  2 | 2020-01-03
  3 | 2020-01-03
  4 | 2020-01-03
  5 | 2020-01-03
  6 | 2020-01-03
  7 | 2020-01-03
  8 | 2020-01-03
  9 | 2020-01-03
 10 | 2020-01-03
(10 rows)

-- ============================================================
-- Case D: DELETE with subquery — the same file-id decode path as
-- UPDATE (fdwFunction.c:1483 mirrors line 1395), so this also broke
-- before the fix.  Fresh tables again so we don't tangle with prior
-- statements' state.
-- ============================================================
DROP TABLE us_heap;
DROP TABLE us_ice;
CREATE TABLE us_heap (id BIGINT, deposit BIGINT, end_date DATE) DISTRIBUTED BY (id);
CREATE ICEBERG TABLE us_ice  (id BIGINT, deposit BIGINT, end_date DATE);
INSERT INTO us_heap SELECT g, 100, DATE '2999-12-31' FROM generate_series(1,10) g;
INSERT INTO us_ice  SELECT g, 100, DATE '2999-12-31' FROM generate_series(1,10) g;
DELETE FROM us_heap WHERE id IN (SELECT id FROM us_pick);
DELETE FROM us_ice  WHERE id IN (SELECT id FROM us_pick);
SELECT COUNT(*) AS heap_total FROM us_heap;
 heap_total 
------------
          7
(1 row)

SELECT COUNT(*) AS ice_total  FROM us_ice;
 ice_total 
-----------
         7
(1 row)

SELECT id FROM us_heap ORDER BY id;
 id 
----
  1
  3
  5
  7
  8
  9
 10
(7 rows)

SELECT id FROM us_ice  ORDER BY id;
 id 
----
  1
  3
  5
  7
  8
  9
 10
(7 rows)

-- ============================================================
-- Cleanup
-- ============================================================
DROP TABLE us_heap;
DROP TABLE us_ice;
DROP TABLE us_pick;
DROP VOLUME us_volume;
DROP USER MAPPING FOR current_user SERVER us_volume_server;
DROP SERVER us_volume_server;
DROP CATALOG us_catalog;
DROP USER MAPPING FOR current_user SERVER us_catalog_server;
DROP SERVER us_catalog_server;
