-- Iceberg + Hive Catalog Smoke Test
-- Tests basic Iceberg functionality using Hive Metastore as the catalog backend
-- and S3/MinIO as the storage layer.
-- Load common setup for datalake_fdw
CREATE EXTENSION IF NOT EXISTS datalake_fdw;
CREATE EXTENSION IF NOT EXISTS hive_connector;
SET datestyle = ISO, MDY;
-- ============================================================
-- Setup: Hive Catalog Server + S3 Volume Server
-- ============================================================
-- Catalog server (Hive Metastore backend)
CREATE SERVER hive_catalog_server
FOREIGN DATA WRAPPER iceberg_catalog_fdw
OPTIONS (
    type 'hive',
    url 'thrift://hive-metastore:9083'
);
CREATE USER MAPPING FOR current_user SERVER hive_catalog_server;
CREATE FOREIGN CATALOG hive_catalog SERVER hive_catalog_server;
SET iceberg_default_catalog = 'hive_catalog';
-- Volume server (S3/MinIO for data storage)
CREATE SERVER hive_volume_server
FOREIGN DATA WRAPPER iceberg_volume_fdw
OPTIONS (
    type 's3',
    endpoint 'http://minio:9000',
    region 'us-east-1',
    bucket_name 'warehouse',
    path_style_access 'true'
);
CREATE USER MAPPING FOR current_user
SERVER hive_volume_server
OPTIONS (
    access_key_id 'admin',
    secret_access_key 'admin12345');
CREATE FOREIGN VOLUME hive_volume SERVER hive_volume_server OPTIONS(base_path '/hive_volume/');
SET iceberg_default_volume = 'hive_volume';
-- ============================================================
-- Test 1: Basic CRUD operations
-- ============================================================
CREATE ICEBERG TABLE iceberg_hive_basic (
    id bigint,
    name text);
-- Empty table scan
SELECT * FROM iceberg_hive_basic;
 id | name 
----+------
(0 rows)

SELECT COUNT(*) FROM iceberg_hive_basic;
 count 
-------
     0
(1 row)

-- INSERT: single row
INSERT INTO iceberg_hive_basic VALUES (1, 'Alice');
-- INSERT: multiple rows
INSERT INTO iceberg_hive_basic VALUES (2, 'Bob'), (3, 'Charlie');
-- INSERT: NULL value
INSERT INTO iceberg_hive_basic VALUES (4, NULL);
-- INSERT: from subquery
INSERT INTO iceberg_hive_basic SELECT 5, 'David';
-- SELECT: full scan ordered
SELECT * FROM iceberg_hive_basic ORDER BY id;
 id |  name   
----+---------
  1 | Alice
  2 | Bob
  3 | Charlie
  4 | 
  5 | David
(5 rows)

-- SELECT: NULL filter
SELECT * FROM iceberg_hive_basic WHERE name IS NULL;
 id | name 
----+------
  4 | 
(1 row)

-- SELECT: NOT NULL filter
SELECT * FROM iceberg_hive_basic WHERE name IS NOT NULL ORDER BY id;
 id |  name   
----+---------
  1 | Alice
  2 | Bob
  3 | Charlie
  5 | David
(4 rows)

-- SELECT: count
SELECT COUNT(*) FROM iceberg_hive_basic;
 count 
-------
     5
(1 row)

-- UPDATE: single row by id
UPDATE iceberg_hive_basic SET name = 'Alice Updated' WHERE id = 1;
-- UPDATE: set to NULL
UPDATE iceberg_hive_basic SET name = NULL WHERE id = 2;
-- UPDATE: by NULL condition
UPDATE iceberg_hive_basic SET name = 'Updated' WHERE name IS NULL;
SELECT * FROM iceberg_hive_basic ORDER BY id;
 id |     name      
----+---------------
  1 | Alice Updated
  2 | Updated
  3 | Charlie
  4 | Updated
  5 | David
(5 rows)

-- DELETE: by id
DELETE FROM iceberg_hive_basic WHERE id = 3;
-- DELETE: by NULL condition (should match no rows after above updates)
DELETE FROM iceberg_hive_basic WHERE name IS NULL;
SELECT * FROM iceberg_hive_basic ORDER BY id;
 id |     name      
----+---------------
  1 | Alice Updated
  2 | Updated
  4 | Updated
  5 | David
(4 rows)

DROP TABLE iceberg_hive_basic;
-- ============================================================
-- Test 2: Multiple data types
-- ============================================================
CREATE ICEBERG TABLE iceberg_hive_types (
    id bigint,
    int_col int,
    float_col float,
    double_col double precision,
    decimal_col decimal(10,2),
    text_col text,
    bool_col boolean,
    date_col date);
INSERT INTO iceberg_hive_types VALUES
    (1, 100, 1.5, 2.5, 99.99, 'hello', true, '2024-01-15'),
    (2, -100, -1.5, -2.5, -99.99, 'world', false, '2024-06-30'),
    (3, 0, 0.0, 0.0, 0.00, '', true, '2024-12-31'),
    (4, NULL, NULL, NULL, NULL, NULL, NULL, NULL);
SELECT * FROM iceberg_hive_types ORDER BY id;
 id | int_col | float_col | double_col | decimal_col | text_col | bool_col |  date_col  
----+---------+-----------+------------+-------------+----------+----------+------------
  1 |     100 |       1.5 |        2.5 |       99.99 | hello    | t        | 2024-01-15
  2 |    -100 |      -1.5 |       -2.5 |      -99.99 | world    | f        | 2024-06-30
  3 |       0 |         0 |          0 |        0.00 |          | t        | 2024-12-31
  4 |         |           |            |             |          |          | 
(4 rows)

-- Type-specific filters
SELECT id, int_col FROM iceberg_hive_types WHERE int_col > 0 ORDER BY id;
 id | int_col 
----+---------
  1 |     100
(1 row)

SELECT id, bool_col FROM iceberg_hive_types WHERE bool_col = true ORDER BY id;
 id | bool_col 
----+----------
  1 | t
  3 | t
(2 rows)

SELECT id, date_col FROM iceberg_hive_types WHERE date_col >= '2024-06-01' ORDER BY id;
 id |  date_col  
----+------------
  2 | 2024-06-30
  3 | 2024-12-31
(2 rows)

SELECT id, decimal_col FROM iceberg_hive_types WHERE decimal_col < 0 ORDER BY id;
 id | decimal_col 
----+-------------
  2 |      -99.99
(1 row)

SELECT id, text_col FROM iceberg_hive_types WHERE text_col = '' ORDER BY id;
 id | text_col 
----+----------
  3 | 
(1 row)

-- NULL checks across types
SELECT id FROM iceberg_hive_types WHERE int_col IS NULL AND float_col IS NULL AND text_col IS NULL ORDER BY id;
 id 
----
  4
(1 row)

DROP TABLE iceberg_hive_types;
-- ============================================================
-- Test 3: Aggregation queries
-- ============================================================
CREATE ICEBERG TABLE iceberg_hive_agg (
    id bigint,
    category text,
    amount decimal(10,2));
INSERT INTO iceberg_hive_agg VALUES
    (1, 'A', 100.00),
    (2, 'A', 200.00),
    (3, 'B', 150.00),
    (4, 'B', 250.00),
    (5, 'C', 300.00);
-- Basic aggregates
SELECT COUNT(*) FROM iceberg_hive_agg;
 count 
-------
     5
(1 row)

SELECT category, COUNT(*) AS cnt, SUM(amount) AS total,
       MIN(amount) AS min_amt, MAX(amount) AS max_amt
FROM iceberg_hive_agg GROUP BY category ORDER BY category;
 category | cnt | total  | min_amt | max_amt 
----------+-----+--------+---------+---------
 A        |   2 | 300.00 |  100.00 |  200.00
 B        |   2 | 400.00 |  150.00 |  250.00
 C        |   1 | 300.00 |  300.00 |  300.00
(3 rows)

-- Filter + aggregate
SELECT category, SUM(amount) AS total
FROM iceberg_hive_agg WHERE amount > 150 GROUP BY category ORDER BY category;
 category | total  
----------+--------
 A        | 200.00
 B        | 250.00
 C        | 300.00
(3 rows)

-- IN filter
SELECT * FROM iceberg_hive_agg WHERE category IN ('A', 'C') ORDER BY id;
 id | category | amount 
----+----------+--------
  1 | A        | 100.00
  2 | A        | 200.00
  5 | C        | 300.00
(3 rows)

-- BETWEEN filter
SELECT * FROM iceberg_hive_agg WHERE amount BETWEEN 150.00 AND 250.00 ORDER BY id;
 id | category | amount 
----+----------+--------
  2 | A        | 200.00
  3 | B        | 150.00
  4 | B        | 250.00
(3 rows)

-- ORDER BY + LIMIT
SELECT * FROM iceberg_hive_agg ORDER BY amount DESC LIMIT 3;
 id | category | amount 
----+----------+--------
  5 | C        | 300.00
  4 | B        | 250.00
  2 | A        | 200.00
(3 rows)

DROP TABLE iceberg_hive_agg;
-- ============================================================
-- Test 4: JOIN with local table
-- ============================================================
CREATE ICEBERG TABLE iceberg_hive_orders (
    order_id bigint,
    customer text,
    total decimal(10,2));
CREATE TABLE local_customers (
    name text,
    city text);
NOTICE:  Table doesn't have 'DISTRIBUTED BY' clause -- Using column named 'name' as the Apache Cloudberry data distribution key for this table.
HINT:  The 'DISTRIBUTED BY' clause determines the distribution of data. Make sure column(s) chosen are the optimal data distribution key to minimize skew.
INSERT INTO iceberg_hive_orders VALUES
    (1, 'Alice', 100.00),
    (2, 'Bob', 200.00),
    (3, 'Charlie', 150.00);
INSERT INTO local_customers VALUES
    ('Alice', 'Beijing'),
    ('Bob', 'Shanghai'),
    ('Dave', 'Shenzhen');
-- INNER JOIN
SELECT o.order_id, o.customer, o.total, c.city
FROM iceberg_hive_orders o
JOIN local_customers c ON o.customer = c.name
ORDER BY o.order_id;
 order_id | customer | total  |   city   
----------+----------+--------+----------
        1 | Alice    | 100.00 | Beijing
        2 | Bob      | 200.00 | Shanghai
(2 rows)

-- LEFT JOIN
SELECT o.order_id, o.customer, c.city
FROM iceberg_hive_orders o
LEFT JOIN local_customers c ON o.customer = c.name
ORDER BY o.order_id;
 order_id | customer |   city   
----------+----------+----------
        1 | Alice    | Beijing
        2 | Bob      | Shanghai
        3 | Charlie  | 
(3 rows)

-- RIGHT JOIN
SELECT o.order_id, c.name, c.city
FROM iceberg_hive_orders o
RIGHT JOIN local_customers c ON o.customer = c.name
ORDER BY c.name;
 order_id | name  |   city   
----------+-------+----------
        1 | Alice | Beijing
        2 | Bob   | Shanghai
          | Dave  | Shenzhen
(3 rows)

-- JOIN with filter
SELECT o.order_id, o.customer, o.total
FROM iceberg_hive_orders o
JOIN local_customers c ON o.customer = c.name
WHERE o.total > 100
ORDER BY o.order_id;
 order_id | customer | total  
----------+----------+--------
        2 | Bob      | 200.00
(1 row)

DROP TABLE iceberg_hive_orders;
DROP TABLE local_customers;
-- ============================================================
-- Test 5: Multiple Iceberg tables interaction
-- ============================================================
CREATE ICEBERG TABLE iceberg_hive_products (
    product_id bigint,
    product_name text,
    price decimal(10,2));
CREATE ICEBERG TABLE iceberg_hive_sales (
    sale_id bigint,
    product_id bigint,
    quantity int);
INSERT INTO iceberg_hive_products VALUES
    (1, 'Laptop', 1299.99),
    (2, 'Mouse', 29.99),
    (3, 'Keyboard', 79.99);
INSERT INTO iceberg_hive_sales VALUES
    (1, 1, 5),
    (2, 2, 20),
    (3, 1, 3),
    (4, 3, 10);
-- JOIN two Iceberg tables
SELECT p.product_name, p.price, s.quantity, (p.price * s.quantity) AS line_total
FROM iceberg_hive_products p
JOIN iceberg_hive_sales s ON p.product_id = s.product_id
ORDER BY s.sale_id;
 product_name |  price  | quantity | line_total 
--------------+---------+----------+------------
 Laptop       | 1299.99 |        5 |    6499.95
 Mouse        |   29.99 |       20 |     599.80
 Laptop       | 1299.99 |        3 |    3899.97
 Keyboard     |   79.99 |       10 |     799.90
(4 rows)

-- Aggregate across Iceberg tables
SELECT p.product_name, SUM(s.quantity) AS total_qty
FROM iceberg_hive_products p
JOIN iceberg_hive_sales s ON p.product_id = s.product_id
GROUP BY p.product_name
ORDER BY p.product_name;
 product_name | total_qty 
--------------+-----------
 Keyboard     |        10
 Laptop       |         8
 Mouse        |        20
(3 rows)

DROP TABLE iceberg_hive_sales;
DROP TABLE iceberg_hive_products;
-- ============================================================
-- Cleanup
-- ============================================================
DROP VOLUME hive_volume;
DROP USER MAPPING FOR current_user SERVER hive_volume_server;
DROP SERVER hive_volume_server;
DROP CATALOG hive_catalog;
DROP USER MAPPING FOR current_user SERVER hive_catalog_server;
DROP SERVER hive_catalog_server;
